[
  { "slug": "dcc-01-los-andes", "type": "episode", "series": "quinta-escena-podcast", "number": 1, "title": "Los Andes · El oficio", "title_provisional": true, "tramo": "La cordillera", "commune": "los-andes", "province": "los-andes", "protagonist_artist": "hugo-hernandez-urtubia", "protagonist_company": "the-magic-show", "discipline": "titeres", "narrative_axis": "El oficio", "natural_location": "Cerro Quicalcura", "natural_location_place": null, "work_location_text": "Taller de construcción y bodega de marionetas de la Compañía The Magic Show", "synopsis_md": null, "status": "planificado", "video_url": null, "audio_url": null, "duration_min": null, "has_subtitles": null, "has_sign_language": null, "transcript_md": null, "capsules": [], "objects": [], "media": [], "related": [], "published_at": null,
    "sources": [ { "url": null, "title": "ruta.py, capítulo 1", "publisher": "Proyecto Quinta Escena Podcast, folio 863000", "type": "documento-proyecto", "level": 1, "role": "primaria", "accessed_at": "2026-09-05", "notes": "Carta de compromiso Los Andes.pdf, 31 de agosto de 2026" } ] },
  { "slug": "dcc-02-putaendo", "type": "episode", "series": "quinta-escena-podcast", "number": 2, "title": "Putaendo · El viaje", "title_provisional": true, "tramo": "El valle alto", "commune": "putaendo", "province": "san-felipe-de-aconcagua", "protagonist_artist": "carlos-munoz-rivera", "protagonist_company": null, "discipline": "clown", "narrative_axis": "El viaje", "natural_location": "Parque Puente Cimbra", "natural_location_place": null, "work_location_text": "Espacio de trabajo y ensayo del artista", "synopsis_md": null, "status": "planificado", "video_url": null, "audio_url": null, "duration_min": null, "has_subtitles": null, "has_sign_language": null, "transcript_md": null, "capsules": [], "objects": [], "media": [], "related": [ { "type": "company", "slug": "festin-de-la-risa" } ], "published_at": null,
    "sources": [ { "url": null, "title": "ruta.py, capítulo 2", "publisher": "Proyecto Quinta Escena Podcast, folio 863000", "type": "documento-proyecto", "level": 1, "role": "primaria", "accessed_at": "2026-09-05", "notes": "Carta de compromiso Putaendo.pdf, 19 de agosto de 2026" } ] },
  { "slug": "dcc-03-la-ligua", "type": "episode", "series": "quinta-escena-podcast", "number": 3, "title": "La Ligua · El territorio", "title_provisional": true, "tramo": "El norte seco", "commune": "la-ligua", "province": "petorca", "protagonist_artist": "nelson-rojas-torres", "protagonist_company": null, "discipline": "teatro", "narrative_axis": "El territorio", "natural_location": "Parque Urbano Natural de La Ligua", "natural_location_place": null, "work_location_text": "Sede de Arte Escénico La Ligua", "synopsis_md": null, "status": "planificado", "video_url": null, "audio_url": null, "duration_min": null, "has_subtitles": null, "has_sign_language": null, "transcript_md": null, "capsules": [], "objects": [], "media": [], "related": [ { "type": "company", "slug": "arte-escenico-la-ligua" } ], "published_at": null,
    "sources": [ { "url": null, "title": "ruta.py, capítulo 3", "publisher": "Proyecto Quinta Escena Podcast, folio 863000", "type": "documento-proyecto", "level": 1, "role": "primaria", "accessed_at": "2026-09-05", "notes": "Carta de compromiso La Ligua.pdf, 22 de agosto de 2026" } ] },
  { "slug": "dcc-04-quillota", "type": "episode", "series": "quinta-escena-podcast", "number": 4, "title": "Quillota · La voz", "title_provisional": true, "tramo": "El valle central", "commune": "quillota", "province": "quillota", "protagonist_artist": "natalia-zuniga-ortiz", "protagonist_company": "productora-abc-arte-bienestar-y-cultura", "discipline": "narracion-oral", "narrative_axis": "La voz", "natural_location": "Parque Aconcagua", "natural_location_place": null, "work_location_text": "Sede de Productora ABC: Arte, Bienestar y Cultura", "synopsis_md": null, "status": "planificado", "video_url": null, "audio_url": null, "duration_min": null, "has_subtitles": null, "has_sign_language": null, "transcript_md": null, "capsules": [], "objects": [], "media": [], "related": [], "published_at": null,
    "sources": [ { "url": null, "title": "ruta.py, capítulo 4", "publisher": "Proyecto Quinta Escena Podcast, folio 863000", "type": "documento-proyecto", "level": 1, "role": "primaria", "accessed_at": "2026-09-05", "notes": "Carta de compromiso Quillota.pdf, 27 de agosto de 2026" } ] },
  { "slug": "dcc-05-villa-alemana", "type": "episode", "series": "quinta-escena-podcast", "number": 5, "title": "Villa Alemana · Las raíces", "title_provisional": true, "tramo": "La puerta", "commune": "villa-alemana", "province": "marga-marga", "protagonist_artist": "victor-opazo-herrera", "protagonist_company": "compania-de-teatro-alegria", "discipline": "teatro", "narrative_axis": "Las raíces", "natural_location": "Parque La Reserva", "natural_location_place": null, "work_location_text": "Sede y sala de ensayo de la Compañía de Teatro Alegría", "synopsis_md": null, "status": "planificado", "video_url": null, "audio_url": null, "duration_min": null, "has_subtitles": null, "has_sign_language": null, "transcript_md": null, "capsules": [], "objects": [], "media": [], "related": [], "published_at": null,
    "sources": [ { "url": null, "title": "ruta.py, capítulo 5", "publisher": "Proyecto Quinta Escena Podcast, folio 863000", "type": "documento-proyecto", "level": 1, "role": "primaria", "accessed_at": "2026-09-05", "notes": "Carta de compromiso Villa alemana.pdf, 25 de agosto de 2026" } ] },
  { "slug": "dcc-06-vina-del-mar", "type": "episode", "series": "quinta-escena-podcast", "number": 6, "title": "Viña del Mar · El cuerpo", "title_provisional": true, "tramo": "El puerto", "commune": "vina-del-mar", "province": "valparaiso", "protagonist_artist": "constanza-mendez-laines", "protagonist_company": null, "discipline": "teatro", "narrative_axis": "El cuerpo", "natural_location": "Parque Natural Gómez Carreño", "natural_location_place": null, "work_location_text": "Espacio de trabajo y ensayo de la artista", "synopsis_md": null, "status": "planificado", "video_url": null, "audio_url": null, "duration_min": null, "has_subtitles": null, "has_sign_language": null, "transcript_md": null, "capsules": [], "objects": [], "media": [], "related": [], "published_at": null,
    "sources": [ { "url": null, "title": "ruta.py, capítulo 6", "publisher": "Proyecto Quinta Escena Podcast, folio 863000", "type": "documento-proyecto", "level": 1, "role": "primaria", "accessed_at": "2026-09-05", "notes": "Carta de compromiso Viña del Mar.pdf, 26 de agosto de 2026" } ] },
  { "slug": "dcc-07-san-antonio", "type": "episode", "series": "quinta-escena-podcast", "number": 7, "title": "San Antonio · La memoria", "title_provisional": true, "tramo": "El mar", "commune": "san-antonio", "province": "san-antonio", "protagonist_artist": "alan-fernandez-caro", "protagonist_company": "compania-de-teatro-la-lancha", "discipline": "teatro", "narrative_axis": "La memoria", "natural_location": "Boca del Maipo", "natural_location_place": null, "work_location_text": "Sede y bodega de la Compañía de Teatro La Lancha", "synopsis_md": null, "status": "planificado", "video_url": null, "audio_url": null, "duration_min": null, "has_subtitles": null, "has_sign_language": null, "transcript_md": null, "capsules": [], "objects": [], "media": [], "related": [ { "type": "work", "slug": "llo-lle-we" } ], "published_at": null,
    "sources": [ { "url": null, "title": "ruta.py, capítulo 7", "publisher": "Proyecto Quinta Escena Podcast, folio 863000", "type": "documento-proyecto", "level": 1, "role": "primaria", "accessed_at": "2026-09-05", "notes": "Carta de compromiso San Antonio.pdf, 21 de agosto de 2026" } ] }
]
